{
  "events": [
    {
      "message": "fixture start",
      "phase": "run",
      "seq": 0,
      "span": null,
      "type": "trace.started"
    },
    {
      "phase": "run",
      "seq": 1,
      "span": null,
      "text": "9007199254740994\n",
      "type": "io.stdout"
    },
    {
      "phase": "run",
      "seq": 2,
      "span": null,
      "text": "matched\n",
      "type": "io.stdout"
    },
    {
      "message": "ok",
      "phase": "run",
      "seq": 3,
      "span": null,
      "type": "trace.ended"
    }
  ],
  "final_state": {
    "budget_remaining": 986,
    "diagnostics": [],
    "exit_code": 0,
    "globals": [],
    "ids": {
      "actors": [
        "actor:root"
      ],
      "channels": [],
      "machines": [],
      "supervisors": [],
      "tasks": []
    },
    "runtime_failures": [],
    "sandbox_rejections": [],
    "status": "ok",
    "stderr": [],
    "stdout": [
      "9007199254740994\n",
      "matched\n"
    ],
    "step_count": 14,
    "virtual_clock": {
      "current_ms": 0,
      "epoch_ms": 0,
      "tick_ms": 1
    }
  },
  "fixture_id": "i64-bigint",
  "hew_version": "0.6.1",
  "profile": "sandbox.sandbox-vm-export.v0",
  "replay": {
    "inputs": [],
    "seed": 26,
    "step_budget": 1000,
    "virtual_clock": {
      "current_ms": 0,
      "epoch_ms": 0,
      "tick_ms": 1
    }
  },
  "result": "ok",
  "sandbox_version": "0.0.0-spec",
  "schema_version": "hew.sandbox.trace.v0",
  "trace_id": "trace:i64-bigint"
}
