{
  "events": [
    {
      "message": "fixture start",
      "phase": "run",
      "seq": 0,
      "span": null,
      "type": "trace.started"
    },
    {
      "phase": "run",
      "seq": 1,
      "span": null,
      "text": "hew: failure: DivideByZero (202)\n",
      "type": "io.stderr"
    },
    {
      "failure": {
        "hew_fault": {
          "code": 202,
          "kind": "DivideByZero"
        },
        "kind": "trap",
        "message": "divide by zero",
        "span": null,
        "trap_kind": "divide_by_zero"
      },
      "phase": "run",
      "seq": 2,
      "span": null,
      "type": "runtime.failure"
    },
    {
      "message": "trap",
      "phase": "run",
      "seq": 3,
      "span": null,
      "type": "trace.ended"
    }
  ],
  "final_state": {
    "budget_remaining": 991,
    "diagnostics": [],
    "exit_code": null,
    "globals": [],
    "ids": {
      "actors": [
        "actor:root"
      ],
      "channels": [],
      "machines": [],
      "supervisors": [],
      "tasks": []
    },
    "runtime_failures": [
      {
        "hew_fault": {
          "code": 202,
          "kind": "DivideByZero"
        },
        "kind": "trap",
        "message": "divide by zero",
        "span": null,
        "trap_kind": "divide_by_zero"
      }
    ],
    "sandbox_rejections": [],
    "status": "trap",
    "stderr": [
      "hew: failure: DivideByZero (202)\n"
    ],
    "stdout": [],
    "step_count": 9,
    "virtual_clock": {
      "current_ms": 0,
      "epoch_ms": 0,
      "tick_ms": 1
    }
  },
  "fixture_id": "divide-by-zero-trap",
  "hew_version": "0.6.1",
  "profile": "sandbox.sandbox-vm-export.v0",
  "replay": {
    "inputs": [],
    "seed": 12,
    "step_budget": 1000,
    "virtual_clock": {
      "current_ms": 0,
      "epoch_ms": 0,
      "tick_ms": 1
    }
  },
  "result": "trap",
  "sandbox_version": "0.0.0-spec",
  "schema_version": "hew.sandbox.trace.v0",
  "trace_id": "trace:divide-by-zero-trap"
}
