{
  "events": [
    {
      "message": "fixture start",
      "phase": "run",
      "seq": 0,
      "span": null,
      "type": "trace.started"
    },
    {
      "id": "supervisor:s1",
      "id_kind": "supervisor",
      "parent_id": "actor:root",
      "phase": "run",
      "seq": 1,
      "span": null,
      "type": "runtime.id_allocated"
    },
    {
      "message": "supervisor.spawn",
      "phase": "run",
      "seq": 2,
      "span": null,
      "text": "{\"supervisor_id\":\"supervisor:s1\"}",
      "type": "state.snapshot"
    },
    {
      "budget_remaining": 998,
      "id": "actor:root",
      "id_kind": "actor",
      "message": "actor.scheduler-step",
      "phase": "run",
      "seq": 3,
      "span": null,
      "step_count": 2,
      "type": "step.committed"
    },
    {
      "phase": "replay",
      "replay_input": {
        "data": {
          "actor_id": "actor:root",
          "family": "actor.scheduler-step",
          "ready_id": 1
        },
        "kind": "user_event"
      },
      "seq": 4,
      "span": null,
      "type": "replay.input"
    },
    {
      "id": "actor:a1",
      "id_kind": "actor",
      "parent_id": "actor:root",
      "phase": "run",
      "seq": 5,
      "span": null,
      "type": "runtime.id_allocated"
    },
    {
      "message": "actor.spawn",
      "phase": "run",
      "seq": 6,
      "span": null,
      "text": "{\"actor_id\":\"actor:a1\"}",
      "type": "state.snapshot"
    },
    {
      "message": "supervisor.child",
      "phase": "run",
      "seq": 7,
      "span": null,
      "text": "{\"child\":0,\"supervisor_id\":\"supervisor:s1\"}",
      "type": "state.snapshot"
    },
    {
      "budget_remaining": 990,
      "id": "actor:root",
      "id_kind": "actor",
      "message": "actor.scheduler-step",
      "phase": "run",
      "seq": 8,
      "span": null,
      "step_count": 10,
      "type": "step.committed"
    },
    {
      "phase": "replay",
      "replay_input": {
        "data": {
          "actor_id": "actor:root",
          "family": "actor.scheduler-step",
          "ready_id": 2
        },
        "kind": "user_event"
      },
      "seq": 9,
      "span": null,
      "type": "replay.input"
    },
    {
      "message": "actor.ask",
      "phase": "run",
      "seq": 10,
      "span": null,
      "text": "{\"actor_id\":\"actor:a1\",\"handler\":\"fail\"}",
      "type": "state.snapshot"
    },
    {
      "budget_remaining": 982,
      "id": "actor:a1",
      "id_kind": "actor",
      "message": "actor.scheduler-step",
      "phase": "run",
      "seq": 11,
      "span": null,
      "step_count": 18,
      "type": "step.committed"
    },
    {
      "phase": "replay",
      "replay_input": {
        "data": {
          "actor_id": "actor:a1",
          "family": "actor.scheduler-step",
          "ready_id": 3
        },
        "kind": "user_event"
      },
      "seq": 12,
      "span": null,
      "type": "replay.input"
    },
    {
      "message": "actor.receive",
      "phase": "run",
      "seq": 13,
      "span": null,
      "text": "{\"actor_id\":\"actor:a1\",\"handler\":\"fail\"}",
      "type": "state.snapshot"
    },
    {
      "phase": "run",
      "seq": 14,
      "span": null,
      "text": "hew: failure: UserPanic (212): boom\n",
      "type": "io.stderr"
    },
    {
      "phase": "run",
      "seq": 15,
      "span": null,
      "text": "hew: actor crash in Worker.fail (actor 1): UserPanic\n",
      "type": "io.stderr"
    },
    {
      "message": "actor.crash",
      "phase": "run",
      "seq": 16,
      "span": null,
      "text": "{\"actor_id\":\"actor:a1\",\"message\":\"boom\"}",
      "type": "state.snapshot"
    },
    {
      "budget_remaining": 973,
      "id": "actor:a1",
      "id_kind": "actor",
      "message": "actor.scheduler-step",
      "phase": "run",
      "seq": 17,
      "span": null,
      "step_count": 27,
      "type": "step.committed"
    },
    {
      "phase": "replay",
      "replay_input": {
        "data": {
          "actor_id": "actor:a1",
          "family": "actor.scheduler-step",
          "ready_id": 4
        },
        "kind": "user_event"
      },
      "seq": 18,
      "span": null,
      "type": "replay.input"
    },
    {
      "budget_remaining": 966,
      "id": "actor:root",
      "id_kind": "actor",
      "message": "actor.scheduler-step",
      "phase": "run",
      "seq": 19,
      "span": null,
      "step_count": 34,
      "type": "step.committed"
    },
    {
      "phase": "replay",
      "replay_input": {
        "data": {
          "actor_id": "actor:root",
          "family": "actor.scheduler-step",
          "ready_id": 5
        },
        "kind": "user_event"
      },
      "seq": 20,
      "span": null,
      "type": "replay.input"
    },
    {
      "budget_remaining": 962,
      "id": "actor:root",
      "id_kind": "actor",
      "message": "actor.scheduler-step",
      "phase": "run",
      "seq": 21,
      "span": null,
      "step_count": 38,
      "type": "step.committed"
    },
    {
      "phase": "replay",
      "replay_input": {
        "data": {
          "actor_id": "actor:root",
          "family": "actor.scheduler-step",
          "ready_id": 6
        },
        "kind": "user_event"
      },
      "seq": 22,
      "span": null,
      "type": "replay.input"
    },
    {
      "phase": "run",
      "seq": 23,
      "span": null,
      "text": "killed\n",
      "type": "io.stdout"
    },
    {
      "message": "ok",
      "phase": "run",
      "seq": 24,
      "span": null,
      "type": "trace.ended"
    }
  ],
  "final_state": {
    "budget_remaining": 941,
    "diagnostics": [],
    "exit_code": 1,
    "globals": [],
    "ids": {
      "actors": [
        "actor:root",
        "actor:a1"
      ],
      "channels": [],
      "machines": [],
      "supervisors": [
        "supervisor:s1"
      ],
      "tasks": []
    },
    "runtime_failures": [],
    "sandbox_rejections": [],
    "status": "ok",
    "stderr": [
      "hew: failure: UserPanic (212): boom\n",
      "hew: actor crash in Worker.fail (actor 1): UserPanic\n"
    ],
    "stdout": [
      "killed\n"
    ],
    "step_count": 59,
    "virtual_clock": {
      "current_ms": 0,
      "epoch_ms": 0,
      "tick_ms": 1
    }
  },
  "fixture_id": "actor-crash-action",
  "hew_version": "0.6.1",
  "profile": "sandbox.sandbox-vm-export.v0",
  "replay": {
    "inputs": [
      {
        "data": {
          "actor_id": "actor:root",
          "family": "actor.scheduler-step",
          "ready_id": 1
        },
        "kind": "user_event"
      },
      {
        "data": {
          "actor_id": "actor:root",
          "family": "actor.scheduler-step",
          "ready_id": 2
        },
        "kind": "user_event"
      },
      {
        "data": {
          "actor_id": "actor:a1",
          "family": "actor.scheduler-step",
          "ready_id": 3
        },
        "kind": "user_event"
      },
      {
        "data": {
          "actor_id": "actor:a1",
          "family": "actor.scheduler-step",
          "ready_id": 4
        },
        "kind": "user_event"
      },
      {
        "data": {
          "actor_id": "actor:root",
          "family": "actor.scheduler-step",
          "ready_id": 5
        },
        "kind": "user_event"
      },
      {
        "data": {
          "actor_id": "actor:root",
          "family": "actor.scheduler-step",
          "ready_id": 6
        },
        "kind": "user_event"
      }
    ],
    "seed": 27,
    "step_budget": 1000,
    "virtual_clock": {
      "current_ms": 0,
      "epoch_ms": 0,
      "tick_ms": 1
    }
  },
  "result": "ok",
  "sandbox_version": "0.0.0-spec",
  "schema_version": "hew.sandbox.trace.v0",
  "trace_id": "trace:actor-crash-action"
}
