{
  "events": [
    {
      "message": "fixture start",
      "phase": "run",
      "seq": 0,
      "span": null,
      "type": "trace.started"
    },
    {
      "id": "actor:a1",
      "id_kind": "actor",
      "parent_id": "actor:root",
      "phase": "run",
      "seq": 1,
      "span": null,
      "type": "runtime.id_allocated"
    },
    {
      "message": "actor.spawn",
      "phase": "run",
      "seq": 2,
      "span": null,
      "text": "{\"actor_id\":\"actor:a1\"}",
      "type": "state.snapshot"
    },
    {
      "message": "actor.ask",
      "phase": "run",
      "seq": 3,
      "span": null,
      "text": "{\"actor_id\":\"actor:a1\",\"handler\":\"echo\"}",
      "type": "state.snapshot"
    },
    {
      "budget_remaining": 989,
      "id": "actor:a1",
      "id_kind": "actor",
      "message": "actor.scheduler-step",
      "phase": "run",
      "seq": 4,
      "span": null,
      "step_count": 11,
      "type": "step.committed"
    },
    {
      "phase": "replay",
      "replay_input": {
        "data": {
          "actor_id": "actor:a1",
          "family": "actor.scheduler-step",
          "ready_id": 1
        },
        "kind": "user_event"
      },
      "seq": 5,
      "span": null,
      "type": "replay.input"
    },
    {
      "message": "actor.receive",
      "phase": "run",
      "seq": 6,
      "span": null,
      "text": "{\"actor_id\":\"actor:a1\",\"handler\":\"echo\"}",
      "type": "state.snapshot"
    },
    {
      "message": "actor.reply",
      "phase": "run",
      "seq": 7,
      "span": null,
      "text": "{\"actor_id\":\"actor:a1\",\"value\":\"pong\"}",
      "type": "state.snapshot"
    },
    {
      "budget_remaining": 982,
      "id": "actor:root",
      "id_kind": "actor",
      "message": "actor.scheduler-step",
      "phase": "run",
      "seq": 8,
      "span": null,
      "step_count": 18,
      "type": "step.committed"
    },
    {
      "phase": "replay",
      "replay_input": {
        "data": {
          "actor_id": "actor:root",
          "family": "actor.scheduler-step",
          "ready_id": 2
        },
        "kind": "user_event"
      },
      "seq": 9,
      "span": null,
      "type": "replay.input"
    },
    {
      "phase": "run",
      "seq": 10,
      "span": null,
      "text": "pong\n",
      "type": "io.stdout"
    },
    {
      "message": "actor.stop",
      "phase": "run",
      "seq": 11,
      "span": null,
      "text": "{\"actor_id\":\"actor:a1\"}",
      "type": "state.snapshot"
    },
    {
      "message": "ok",
      "phase": "run",
      "seq": 12,
      "span": null,
      "type": "trace.ended"
    }
  ],
  "final_state": {
    "budget_remaining": 958,
    "diagnostics": [],
    "exit_code": 0,
    "globals": [],
    "ids": {
      "actors": [
        "actor:root",
        "actor:a1"
      ],
      "channels": [],
      "machines": [],
      "supervisors": [],
      "tasks": []
    },
    "runtime_failures": [],
    "sandbox_rejections": [],
    "status": "ok",
    "stderr": [],
    "stdout": [
      "pong\n"
    ],
    "step_count": 42,
    "virtual_clock": {
      "current_ms": 0,
      "epoch_ms": 0,
      "tick_ms": 1
    }
  },
  "fixture_id": "actor-ask-reply",
  "hew_version": "0.6.1",
  "profile": "sandbox.sandbox-vm-export.v0",
  "replay": {
    "inputs": [
      {
        "data": {
          "actor_id": "actor:a1",
          "family": "actor.scheduler-step",
          "ready_id": 1
        },
        "kind": "user_event"
      },
      {
        "data": {
          "actor_id": "actor:root",
          "family": "actor.scheduler-step",
          "ready_id": 2
        },
        "kind": "user_event"
      }
    ],
    "seed": 16,
    "step_budget": 1000,
    "virtual_clock": {
      "current_ms": 0,
      "epoch_ms": 0,
      "tick_ms": 1
    }
  },
  "result": "ok",
  "sandbox_version": "0.0.0-spec",
  "schema_version": "hew.sandbox.trace.v0",
  "trace_id": "trace:actor-ask-reply"
}
