{
  "events": [
    {
      "message": "fixture start",
      "phase": "run",
      "seq": 0,
      "span": null,
      "type": "trace.started"
    },
    {
      "phase": "replay",
      "replay_input": {
        "data": "Ada",
        "kind": "stdin"
      },
      "seq": 1,
      "span": null,
      "type": "replay.input"
    },
    {
      "budget_remaining": 994,
      "id": "actor:root",
      "id_kind": "actor",
      "message": "actor.scheduler-step",
      "phase": "run",
      "seq": 2,
      "span": null,
      "step_count": 6,
      "type": "step.committed"
    },
    {
      "phase": "replay",
      "replay_input": {
        "data": {
          "actor_id": "actor:root",
          "family": "actor.scheduler-step",
          "ready_id": 1
        },
        "kind": "user_event"
      },
      "seq": 3,
      "span": null,
      "type": "replay.input"
    },
    {
      "phase": "run",
      "seq": 4,
      "span": null,
      "text": "hello Ada\n",
      "type": "io.stdout"
    },
    {
      "message": "ok",
      "phase": "run",
      "seq": 5,
      "span": null,
      "type": "trace.ended"
    }
  ],
  "final_state": {
    "budget_remaining": 939,
    "diagnostics": [],
    "exit_code": 0,
    "globals": [],
    "ids": {
      "actors": [
        "actor:root"
      ],
      "channels": [],
      "machines": [],
      "supervisors": [],
      "tasks": []
    },
    "runtime_failures": [],
    "sandbox_rejections": [],
    "status": "ok",
    "stderr": [],
    "stdout": [
      "hello Ada\n"
    ],
    "step_count": 61,
    "virtual_clock": {
      "current_ms": 0,
      "epoch_ms": 0,
      "tick_ms": 1
    }
  },
  "fixture_id": "replay-stdin",
  "hew_version": "0.6.1",
  "profile": "sandbox.sandbox-vm-export.v0",
  "replay": {
    "inputs": [
      {
        "data": "Ada",
        "kind": "stdin"
      },
      {
        "data": {
          "actor_id": "actor:root",
          "family": "actor.scheduler-step",
          "ready_id": 1
        },
        "kind": "user_event"
      }
    ],
    "seed": 21,
    "step_budget": 1000,
    "virtual_clock": {
      "current_ms": 0,
      "epoch_ms": 0,
      "tick_ms": 1
    }
  },
  "result": "ok",
  "sandbox_version": "0.0.0-spec",
  "schema_version": "hew.sandbox.trace.v0",
  "trace_id": "trace:replay-stdin"
}
