{"schema_version":"hew.sandbox.trace.v0","trace_id":"trace:actor-state-arity-trap","fixture_id":"actor-state-arity-trap","profile":"sandbox.educational.v0","hew_version": "0.6.0-rc4","sandbox_version":"0.0.0-spec","result":"ok","replay":{"seed":28,"step_budget":1000,"virtual_clock":{"epoch_ms":0,"tick_ms":1,"current_ms":0},"inputs":[{"kind":"user_event","data":{"family":"actor.scheduler-step","actor_id":"actor:a1"}},{"kind":"user_event","data":{"family":"actor.scheduler-step","actor_id":"actor:a1"}}]},"events":[{"seq":0,"type":"trace.started","phase":"run","span":null,"message":"fixture start"},{"seq":1,"type":"runtime.id_allocated","phase":"run","span":null,"id_kind":"actor","id":"actor:a1","parent_id":"actor:root"},{"seq":2,"type":"state.snapshot","phase":"run","span":null,"message":"actor.spawn","text":"{\"actor_id\":\"actor:a1\",\"alive\":true,\"layout\":\"type:Pair\",\"mailbox_depth\":0,\"parent_id\":\"actor:root\",\"state\":[0,0]}"},{"seq":3,"type":"state.snapshot","phase":"run","span":null,"message":"actor.send","text":"{\"actor_id\":\"actor:a1\",\"from\":\"actor:root\",\"handler\":\"bad\",\"mailbox_depth\":1,\"message_id\":\"message:m1\",\"payload\":[],\"reply_id\":null}"},{"seq":4,"type":"state.snapshot","phase":"run","span":null,"message":"actor.mailbox-watermark","text":"{\"actor_id\":\"actor:a1\",\"mailbox_depth\":1,\"max_mailbox\":4,\"threshold\":25}"},{"seq":5,"type":"step.committed","phase":"run","span":null,"message":"actor.scheduler-step","id_kind":"actor","id":"actor:a1","step_count":5,"budget_remaining":995},{"seq":6,"type":"replay.input","phase":"replay","span":null,"replay_input":{"kind":"user_event","data":{"family":"actor.scheduler-step","actor_id":"actor:a1"}}},{"seq":7,"type":"step.committed","phase":"run","span":null,"message":"actor.scheduler-step","id_kind":"actor","id":"actor:a1","step_count":6,"budget_remaining":994},{"seq":8,"type":"replay.input","phase":"replay","span":null,"replay_input":{"kind":"user_event","data":{"family":"actor.scheduler-step","actor_id":"actor:a1"}}},{"seq":9,"type":"state.snapshot","phase":"run","span":null,"message":"actor.receive","text":"{\"actor_id\":\"actor:a1\",\"from\":\"actor:root\",\"handler\":\"bad\",\"mailbox_depth\":0,\"message_id\":\"message:m1\",\"payload\":[],\"reply_id\":null}"},{"seq":10,"type":"state.snapshot","phase":"run","span":null,"message":"actor.crash","text":"{\"actor_id\":\"actor:a1\",\"failure\":\"actor state arity mismatch: expected 2, got 1\",\"trap_kind\":\"invalid_record_field\"}"},{"seq":11,"type":"trace.ended","phase":"run","span":null,"message":"ok"}],"final_state":{"status":"ok","exit_code":0,"step_count":9,"budget_remaining":991,"virtual_clock":{"epoch_ms":0,"tick_ms":1,"current_ms":0},"stdout":[],"stderr":[],"ids":{"actors":["actor:root","actor:a1"],"channels":[],"tasks":[],"supervisors":[],"machines":[]},"diagnostics":[],"sandbox_rejections":[],"runtime_failures":[],"globals":[]}}
