{"schema_version":"hew.sandbox.trace.v0","trace_id":"trace:mixed-scalar-compare-trap","fixture_id":"mixed-scalar-compare-trap","profile":"sandbox.educational.v0","hew_version": "0.6.0-rc4","sandbox_version":"0.0.0-spec","result":"trap","replay":{"seed":29,"step_budget":1000,"virtual_clock":{"epoch_ms":0,"tick_ms":1,"current_ms":0},"inputs":[]},"events":[{"seq":0,"type":"trace.started","phase":"run","span":null,"message":"fixture start"},{"seq":1,"type":"runtime.failure","phase":"run","span":null,"failure":{"kind":"trap","message":"mixed scalar comparison requires matching operand types (i64 vs f64)","span":null,"trap_kind":"invalid_local"}},{"seq":2,"type":"trace.ended","phase":"run","span":null,"message":"trap"}],"final_state":{"status":"trap","exit_code":null,"step_count":3,"budget_remaining":997,"virtual_clock":{"epoch_ms":0,"tick_ms":1,"current_ms":0},"stdout":[],"stderr":[],"ids":{"actors":["actor:root"],"channels":[],"tasks":[],"supervisors":[],"machines":[]},"diagnostics":[],"sandbox_rejections":[],"runtime_failures":[{"kind":"trap","message":"mixed scalar comparison requires matching operand types (i64 vs f64)","span":null,"trap_kind":"invalid_local"}],"globals":[]}}
