{"schema_version":"hew.sandbox.trace.v0","trace_id":"trace:channel-select","fixture_id":"channel-select","profile":"sandbox.educational.v0","hew_version": "0.6.0-rc4","sandbox_version":"0.0.0-spec","result":"ok","replay":{"seed":17,"step_budget":1000,"virtual_clock":{"epoch_ms":0,"tick_ms":1,"current_ms":0},"inputs":[]},"events":[{"seq":0,"type":"trace.started","phase":"run","span":null,"message":"fixture start"},{"seq":1,"type":"runtime.id_allocated","phase":"run","span":null,"id_kind":"channel","id":"channel:c1","parent_id":null},{"seq":2,"type":"io.stdout","phase":"run","span":null,"text":"7\n"},{"seq":3,"type":"trace.ended","phase":"run","span":null,"message":"ok"}],"final_state":{"status":"ok","exit_code":0,"step_count":14,"budget_remaining":986,"virtual_clock":{"epoch_ms":0,"tick_ms":1,"current_ms":0},"stdout":["7\n"],"stderr":[],"ids":{"actors":["actor:root"],"channels":["channel:c1"],"tasks":[],"supervisors":[],"machines":[]},"diagnostics":[],"sandbox_rejections":[],"runtime_failures":[],"globals":[]}}
