{
  "events": [
    {
      "message": "fixture start",
      "phase": "run",
      "seq": 0,
      "span": null,
      "type": "trace.started"
    },
    {
      "id": "channel:c1",
      "id_kind": "channel",
      "parent_id": "actor:root",
      "phase": "run",
      "seq": 1,
      "span": null,
      "type": "runtime.id_allocated"
    },
    {
      "budget_remaining": 961,
      "id": "actor:root",
      "id_kind": "actor",
      "message": "actor.scheduler-step",
      "phase": "run",
      "seq": 2,
      "span": null,
      "step_count": 39,
      "type": "step.committed"
    },
    {
      "phase": "replay",
      "replay_input": {
        "data": {
          "actor_id": "actor:root",
          "family": "actor.scheduler-step",
          "ready_id": 1
        },
        "kind": "user_event"
      },
      "seq": 3,
      "span": null,
      "type": "replay.input"
    },
    {
      "budget_remaining": 946,
      "id": "actor:root",
      "id_kind": "actor",
      "message": "actor.scheduler-step",
      "phase": "run",
      "seq": 4,
      "span": null,
      "step_count": 54,
      "type": "step.committed"
    },
    {
      "phase": "replay",
      "replay_input": {
        "data": {
          "actor_id": "actor:root",
          "family": "actor.scheduler-step",
          "ready_id": 2
        },
        "kind": "user_event"
      },
      "seq": 5,
      "span": null,
      "type": "replay.input"
    },
    {
      "budget_remaining": 942,
      "id": "actor:root",
      "id_kind": "actor",
      "message": "actor.scheduler-step",
      "phase": "run",
      "seq": 6,
      "span": null,
      "step_count": 58,
      "type": "step.committed"
    },
    {
      "phase": "replay",
      "replay_input": {
        "data": {
          "actor_id": "actor:root",
          "family": "actor.scheduler-step",
          "ready_id": 3
        },
        "kind": "user_event"
      },
      "seq": 7,
      "span": null,
      "type": "replay.input"
    },
    {
      "phase": "run",
      "seq": 8,
      "span": null,
      "text": "7\n",
      "type": "io.stdout"
    },
    {
      "message": "ok",
      "phase": "run",
      "seq": 9,
      "span": null,
      "type": "trace.ended"
    }
  ],
  "final_state": {
    "budget_remaining": 922,
    "diagnostics": [],
    "exit_code": 0,
    "globals": [],
    "ids": {
      "actors": [
        "actor:root"
      ],
      "channels": [
        "channel:c1"
      ],
      "machines": [],
      "supervisors": [],
      "tasks": []
    },
    "runtime_failures": [],
    "sandbox_rejections": [],
    "status": "ok",
    "stderr": [],
    "stdout": [
      "7\n"
    ],
    "step_count": 78,
    "virtual_clock": {
      "current_ms": 0,
      "epoch_ms": 0,
      "tick_ms": 1
    }
  },
  "fixture_id": "pipe-select",
  "hew_version": "0.9.4",
  "profile": "sandbox.sandbox-vm-export.v0",
  "replay": {
    "inputs": [
      {
        "data": {
          "actor_id": "actor:root",
          "family": "actor.scheduler-step",
          "ready_id": 1
        },
        "kind": "user_event"
      },
      {
        "data": {
          "actor_id": "actor:root",
          "family": "actor.scheduler-step",
          "ready_id": 2
        },
        "kind": "user_event"
      },
      {
        "data": {
          "actor_id": "actor:root",
          "family": "actor.scheduler-step",
          "ready_id": 3
        },
        "kind": "user_event"
      }
    ],
    "seed": 17,
    "step_budget": 1000,
    "virtual_clock": {
      "current_ms": 0,
      "epoch_ms": 0,
      "tick_ms": 1
    }
  },
  "result": "ok",
  "sandbox_version": "0.0.0-spec",
  "schema_version": "hew.sandbox.trace.v0",
  "trace_id": "trace:pipe-select"
}
