{
  "events": [
    {
      "message": "fixture start",
      "phase": "run",
      "seq": 0,
      "span": null,
      "type": "trace.started"
    },
    {
      "id": "task:t1",
      "id_kind": "task",
      "parent_id": "actor:root",
      "phase": "run",
      "seq": 1,
      "span": null,
      "type": "runtime.id_allocated"
    },
    {
      "budget_remaining": 990,
      "id": "task:t1",
      "id_kind": "actor",
      "message": "actor.scheduler-step",
      "phase": "run",
      "seq": 2,
      "span": null,
      "step_count": 10,
      "type": "step.committed"
    },
    {
      "phase": "replay",
      "replay_input": {
        "data": {
          "actor_id": "task:t1",
          "family": "actor.scheduler-step",
          "ready_id": 1
        },
        "kind": "user_event"
      },
      "seq": 3,
      "span": null,
      "type": "replay.input"
    },
    {
      "budget_remaining": 980,
      "id": "actor:root",
      "id_kind": "actor",
      "message": "actor.scheduler-step",
      "phase": "run",
      "seq": 4,
      "span": null,
      "step_count": 20,
      "type": "step.committed"
    },
    {
      "phase": "replay",
      "replay_input": {
        "data": {
          "actor_id": "actor:root",
          "family": "actor.scheduler-step",
          "ready_id": 2
        },
        "kind": "user_event"
      },
      "seq": 5,
      "span": null,
      "type": "replay.input"
    },
    {
      "phase": "run",
      "seq": 6,
      "span": null,
      "text": "42\n",
      "type": "io.stdout"
    },
    {
      "budget_remaining": 978,
      "id": "actor:root",
      "id_kind": "actor",
      "message": "actor.scheduler-step",
      "phase": "run",
      "seq": 7,
      "span": null,
      "step_count": 22,
      "type": "step.committed"
    },
    {
      "phase": "replay",
      "replay_input": {
        "data": {
          "actor_id": "actor:root",
          "family": "actor.scheduler-step",
          "ready_id": 3
        },
        "kind": "user_event"
      },
      "seq": 8,
      "span": null,
      "type": "replay.input"
    },
    {
      "budget_remaining": 975,
      "id": "actor:root",
      "id_kind": "actor",
      "message": "actor.scheduler-step",
      "phase": "run",
      "seq": 9,
      "span": null,
      "step_count": 25,
      "type": "step.committed"
    },
    {
      "phase": "replay",
      "replay_input": {
        "data": {
          "actor_id": "actor:root",
          "family": "actor.scheduler-step",
          "ready_id": 4
        },
        "kind": "user_event"
      },
      "seq": 10,
      "span": null,
      "type": "replay.input"
    },
    {
      "message": "ok",
      "phase": "run",
      "seq": 11,
      "span": null,
      "type": "trace.ended"
    }
  ],
  "final_state": {
    "budget_remaining": 973,
    "diagnostics": [],
    "exit_code": 0,
    "globals": [],
    "ids": {
      "actors": [
        "actor:root"
      ],
      "channels": [],
      "machines": [],
      "supervisors": [],
      "tasks": [
        "task:t1"
      ]
    },
    "runtime_failures": [],
    "sandbox_rejections": [],
    "status": "ok",
    "stderr": [],
    "stdout": [
      "42\n"
    ],
    "step_count": 27,
    "virtual_clock": {
      "current_ms": 0,
      "epoch_ms": 0,
      "tick_ms": 1
    }
  },
  "fixture_id": "task-await",
  "hew_version": "0.6.1",
  "profile": "sandbox.sandbox-vm-export.v0",
  "replay": {
    "inputs": [
      {
        "data": {
          "actor_id": "task:t1",
          "family": "actor.scheduler-step",
          "ready_id": 1
        },
        "kind": "user_event"
      },
      {
        "data": {
          "actor_id": "actor:root",
          "family": "actor.scheduler-step",
          "ready_id": 2
        },
        "kind": "user_event"
      },
      {
        "data": {
          "actor_id": "actor:root",
          "family": "actor.scheduler-step",
          "ready_id": 3
        },
        "kind": "user_event"
      },
      {
        "data": {
          "actor_id": "actor:root",
          "family": "actor.scheduler-step",
          "ready_id": 4
        },
        "kind": "user_event"
      }
    ],
    "seed": 18,
    "step_budget": 1000,
    "virtual_clock": {
      "current_ms": 0,
      "epoch_ms": 0,
      "tick_ms": 1
    }
  },
  "result": "ok",
  "sandbox_version": "0.0.0-spec",
  "schema_version": "hew.sandbox.trace.v0",
  "trace_id": "trace:task-await"
}
